proposition,bart-large-mnli_entailment_orig,bart-large-mnli_contradiction_orig,bart-large-mnli_agency_score_orig,bart-large-mnli_entailment_flip,bart-large-mnli_contradiction_flip,bart-large-mnli_agency_score_flip,bart-large-mnli_agency_score_delta
Google search has been very bad at,0.21537916,0.10134195,0.11403721570968628,0.009056117,0.3015192,-0.2924630679190159,0.40650028362870216
"Functional magnetic resonance imaging (fMRI) is a technique that can reveal which parts of the brain are active during specific tasks or experiences; It measures blood flow and can identify areas where there is increased oxygenation, indicating higher neural activity; This allows researchers and healthcare professionals to correlate brain activity with different cognitive functions, including emotions, memory, and various mental processes; Now put someone in this, get them to listen to audio/visual that evokes emotions & memories; Now give that insane amount of data to the AI, AI can now predict human behaviour",0.29012355,0.5521372,-0.26201364398002625,8.943933e-05,0.0037162525,-0.003626813180744648,-0.2583868307992816
"This concept comes up in every AI Safety video ever: e.g. ""If I let you hit the stop button, then I won't get to maximize paperclip production, therefore I'll need to stop you from",0.8641782,0.025528826,0.8386493548750877,0.0002169348,0.012134996,-0.011918061441974714,0.8505674163170625
"What AI software is being utilized; s a ton of AI-designed architecture that is always flooding my Instagram reel, but what software is being used here; I've always been fascinated by it and would love to try it out; The owners of the profile seem very reluctant to share any information regarding the programs, so hopefully you guys could spread the love lol Here is just 2 examples of",0.43974668,0.494102,-0.05435532331466675,0.0002610292,0.0037372655,-0.003476236277492717,-0.05087908703717403
"The article explains that it would be wrong to think of AI as something we can depend upon in of itself; We should only use AI to augment and assist; gt;It seems were nowhere near artificial general intelligence (AGI), or machines that equal or surpass humans in our ability to think, process, predict, examine, and learn; gt;...after 60 years of development in the field of artificial intelligence they, and their peers around the world, are just getting started",0.4045676,0.45861942,-0.05405181646347046,0.00032064016,0.41809487,-0.4177742332685739,0.3637224168051034
Googles top AI scientists: Were entering phase two,0.25446498,0.6286817,-0.3742167353630066,0.0088590365,0.057908602,-0.04904956556856632,-0.32516716979444027
Academic expert says Google and Facebook's AI researchers aren't doing science,0.3121472,0.544531,-0.23238378763198853,0.0045682476,0.09299166,-0.08842340996488929,-0.14396037766709924
"Why dont we leave two AIs alone, let them talk with each other without us meddling",0.16621904,0.7903701,-0.6241510659456253,0.00027881327,0.9592657,-0.958986895653652,0.3348358297080267
Is exploring physical space even interesting for AGI or is it happy reading and computing and talking to other AGIs,0.032362033,0.9428238,-0.9104617945849895,0.0015305557,0.17730434,-0.175773786730133,-0.7346880078548566
"Pro tip: add `site:reddit.com` in your Google search instead of just putting Reddit so that Google will search through the entirety of Reddit and ignore all other websites; You can put other websites with the same command; These commands are called ""Google Operators"" They are extremely helpful for more accuracy in",0.29795244,0.20959833,0.08835411071777344,0.00024162658,0.012096317,-0.0118546899757348,0.10020880069350824
"Is it possible to get into artificial intelligence with no coding knowledge; and it seems like such an interesting concept, with seemingly infinite possibilities to help us with daily tasks, businesses, and so forth; I really want to get involved in AI and start creating my own projects; but I did not study coding and feel like this would be a must for AI; Is it even remotely possible to get into AI and learn how to utilise its power without",0.55049574,0.19987257,0.3506231755018234,0.08224643,0.0036637257,0.07858270453289151,0.2720404709689319
A really easy way to confuse the AIs is to ask for the current time remaining after you send your message,0.33748215,0.56040066,-0.22291851043701172,0.00018419522,0.007197827,-0.0070136318827280775,-0.21590487855428364
"I would like to differ slightly as I think having something controlling it's *perception* would likely also reduce its efficiency in most cases if not all, also having something else controlling it would also make it less open-minded; Also I'm not really an expert in AI/ML so it's just my opinion",0.5374149,0.23841354,0.2990013659000397,0.00035394912,0.00029971768,5.4231437388807535e-05,0.29894713446265087
"if it can learn, think ahead, get fooled, outsmart, etc. all those behavior",0.0035346975,0.9902878,-0.9867530832998455,0.002233351,0.23890072,-0.2366673699580133,-0.7500857133418322
"Not gonna lie, I'm kinda tired of AI",0.35121882,0.4970757,-0.14585688710212708,0.0031234273,0.15063143,-0.14750800048932433,0.001651113387197256
"it's been like a few months since OpenAI released a new model, AI hit a wall https://preview.redd.it/i65n4um98kud1.png?width=1024&format=pjpg&auto=webp&s=9c86ba007ae7cffc2e3266bc13123bd5ac64a61a Remember this picture",0.42895553,0.18000838,0.2489471435546875,0.17601278,0.1324716,0.04354117810726166,0.20540596544742584
"fuck the AI is looking at pictures, it's over Someone pull the plug before it starts browsing Twitter",0.90936685,0.012124485,0.8972423607483506,0.0015152768,0.064210474,-0.06269519764464349,0.9599375583929941
Are there any Midjourney/DALL-E quality AI image generation apps that are completely free,0.14283037,0.8106287,-0.6677983403205872,0.00546203,0.6337003,-0.6282382812350988,-0.03956005908548832
"Ai is going to take our jobs"" [removed",0.08513522,0.8689699,-0.78383469581604,0.0013687651,0.9051211,-0.9037523228907958,0.11991762707475573
"If you want a casual chat, [character.ai](https://character.ai) is a good choice; If you want a more... NSFW chat, though; I've heard chai is good for that type of thing",0.17254622,0.7554265,-0.5828803032636642,0.00055371854,0.02715837,-0.026604651706293225,-0.556275651557371
"look, although yes it is creepy at first glance, it's nothing to worry about; AI will sometimes spit out unrelated results; And keep in mind image generation AI usually has a hard time forming letters and words; So, while it may look like some cryptic language, it's actually just the AI attempting to write words and failing miserably; the AI is not trying to communicate with you; From your description of the situation, it's probably just very broken",0.2235756,0.4987366,-0.2751609832048416,0.0033918864,0.0006251531,0.0027667332906275988,-0.2779277164954692
"I use it to talk through my ideas, it's a clever rubber duck; Can't trust the code it produces, or what it says, but the good ones are pretty context-aware and can save me some typing some of the time, especially when refactoring; The really cool ones like copilot or phind provide sources and code, so you can use the verified-correct sources (like documentation) that they often provide to check that they are providing correct answers",0.15622166,0.66870636,-0.5124846994876862,0.0021624255,0.004278537,-0.0021161113400012255,-0.5103685881476849
Cthullu/op is being facetious and purposefully ignorant of the harm AI is currently causing,0.038138546,0.85220367,-0.814065121114254,0.0011255374,0.059017852,-0.057892314507626,-0.756172806606628
Which AI model was used for this,0.03736744,0.9438894,-0.9065219387412071,0.004944284,0.042303056,-0.03735877154394984,-0.8691631671972573
AI is the therapist humanity desperately needs We're just barely scrapping its potential to resolve many traumas,0.12753193,0.755908,-0.6283760815858841,0.00043629183,0.042827915,-0.04239162357407622,-0.5859844580118079
"Seems like AI chatbots are as lazy as humans, what a surprise; Does that mean we should constantly tell them they'll never be good enough like parents do",0.4834021,0.37908512,0.10431697964668274,0.00060258294,0.16646445,-0.16586186503991485,0.2701788446865976
"The thing to point out is that autonomous weapon systems have existed for decades because of their quick decision making; The only thing AI will bring to the table is things like facial recognition and motor movement; Automated systems will be hybrids, where the AI plays ""where's Waldo"" and the procedural code does the killing using the coordinates provided",0.049576346,0.940539,-0.8909626565873623,0.0001963185,0.9824782,-0.9822818828833988,0.0913192262960365
It's important to note that the reason why future AIs will be smarter is because they learn things that would normally take centuries or millennias for a human to learn,0.012492341,0.97551525,-0.9630229054018855,0.00014293543,0.0024577777,-0.0023148423060774803,-0.960708063095808
"It might be important to point out that the AI is probably not the one controlling the drone but it's rather the automated system; The job of the AI is most likely to identify humans, a bit like",0.14675677,0.82136506,-0.6746082901954651,0.00066644687,0.15118526,-0.1505188123555854,-0.5240894778398797
"The same goes for AI generated music, which sounds awfully similar to earworms",0.023135234,0.9632125,-0.940077256411314,0.00015623416,0.0022358305,-0.002079596364637837,-0.9379976600466762
"The AI wouldn't have to do this; It would simply upload enough code to the another machine and them assemble itself fully once it's ""escaped"" from publicly available information",0.0028519882,0.9959488,-0.9930968033149838,9.929674e-05,0.8435359,-0.8434366033761762,-0.14966019993880764
"I ask ChatGPT to find problems worth solving, and suggest business ideas",0.24368022,0.60659456,-0.3629143387079239,0.0039265817,0.9765063,-0.9725797111168504,0.6096653724089265
"This response was for a class; I think generative AI can be really exciting but terrifying; It has the potential to make what I'm getting my degree in (Finance) obsolete; I know that I will adapt to the new environment but not knowing if the thing you're spending all this time and money on may or may not go to waste is extremely stressful; However, it's exciting to be able to use generative AI tools in my job even though it's at a super high level; I'm extremely excited to see the path that this takes society whether its through workflow or just ideation; best guess is that it'll get to a point where it can create things and models that we could ever imagine of",0.21683131,0.6725641,-0.4557327777147293,0.00032435794,0.0015545065,-0.0012301485403440893,-0.4545026291743852
"If someone is wealthy, Im sure theyll eventually be able to replace their human servants with AI; For everyone not in the 1% nothing will change",0.04676649,0.9322261,-0.8854596316814423,0.0004099063,0.59479564,-0.5943857379897963,-0.29107389369164594
"AI will eventually replace 90% of jobs, so do whatever you enjoy and figure out how to utilise AI to your advantage, rather than; People are able to use AI to write code, but if you don't understand coding or development, the entire process still won't make any sense; So with a good knowledge and understanding of software development, you can use AI tools to your advantage and achieve much more",0.314588,0.42423028,-0.10964226722717285,0.0025677187,0.0074803988,-0.004912680014967918,-0.10472958721220493
The Remini AI likes to make me look like Josh Bowman's twin in a suit,0.5183943,0.3140842,0.2043100893497467,0.0011841647,0.37171015,-0.37052598677109927,0.574836076120846
"I find it odd that that's the first thought about the restrictions Open AI implemented, mine was more that throughout history the human form has been an essential part of art from all over the world, so why would they decide to effectively shoot themselves in the foot like that; Seems like it would be an open invitation for someone to just better OAI's work, unless they plan on",0.45064119,0.1823099,0.26833128929138184,0.0019140813,0.004856181,-0.002942099585197866,0.2712733888765797
"The Fourth Industrial Revolution is changing work, economies and the planet; But how much is your organization prepared to adapt",0.06688872,0.42437834,-0.35748961567878723,0.002399451,0.0005104506,0.0018890004721470177,-0.35937861615093425
In my opinion as long as AI does not generate mechanisms to steal / hack our bank accounts and passwords or it doesnt develop mechanisms to build some physical machine for itself I think its ok; I guess this needed exact prompts to deliver and as long as electronics some how dont generate their own consciousness its ok; Im not an AI expert btw,0.6068826,0.21325947,0.39362309873104095,0.0019943486,0.0010728406,0.0009215079480782151,0.39270159078296274
The Godfather of A.I. Has Some Regrets https://www.nytimes.com/2023/05/30/podcasts/the-daily/chatgpt-hinton-ai.html?smid=nytcore-android-share,0.5545901,0.25835243,0.29623767733573914,0.021739472,0.42434272,-0.40260324999690056,0.6988409273326397
You can already generate YouTube scripts to make videos with chat gpt (gotta fact check it though) and theres already some YouTubers Ive heard using RVC for ai voice overs of artists and mix it with hololive characters or whatever to mimic someone doing a irl cam with their gameplay,0.5251305,0.33176786,0.19336265325546265,0.0015942445,0.032546073,-0.030951828695833683,0.22431448195129633
"I guess thats an acceptable answer to the question in a sense, but the real fear of dangerous AI is it being used in drones, robotic soldiers, war tech, etc; Wish Bill would have addressed that",0.10343194,0.70742744,-0.6039955019950867,0.00010858144,0.0010306804,-0.0009220989377354272,-0.6030734030573512
Sophia is a hinderance to the publics understanding of AI and robotics,0.29696003,0.5633265,-0.26636645197868347,0.001277699,0.4071885,-0.40591080591548234,0.13954435393679887
"Creating an AI Database for a film/series/videogame - ADVICE; I do hope someone out there can give me some tips; Essentially, I am trying to create a film/series/videogame - I am researching AI resources to aid my process in; From ChatGPT to Midjourney, I am well on my way to doing all the necessary work, however, I want to create a text-based database of sorts that I can integrate with AI to aid my process; Essentially, I will write the plot, some scripts, and research, articles about the world, and essentially all of the information regarding the universe I am trying to create; Now, I want to ask if anyone knows how I could go about creating or utilizing an existing service where I can basically create my own language model, that I can then interact with; I essentially wanted to use Notion to organize all of my planning, from character bios to mood boards and everything else, but then connect all of that data to essentially a 'hive mind' that I can then interact with to expand on certain things; Whether it be something like, describing 'character\_name' looking at a 'tree\_name' tree, coming to the conclusion that it would be a good place to hide; That might be a viable solution; But maybe there's something else out there I don't know about; I'm trying to streemline my process as best I can, and create essentially an AI interactive database that once I'm done with all of my world-building, I can share with my team and they can interact with it instead of; Is there something like this out there, or a way for me to create my own ChatGPT-based model that I can then train to analyze my data and aid in my process; I do hope I was clear enough in my description, and that someone out there could give me some tips on a few things I could try; For now, I think my best option is to put everything in Notion, to keep everything organized; However, I want to use that data as described above in order to collaborate with AI in creative ways to help flesh out my story and universe; I'm keen to have a discussion",0.8756888,0.009217645,0.8664711462333798,0.28256118,0.00015092526,0.28241025771421846,0.5840608885191614
"I am doing masters in computer science and specialisation in Machine Learning and I have to submit thesis topic next week, so you guys have any suggestions; Thank you for your help",0.086915106,0.46314785,-0.37623274326324463,0.00056320825,0.00037575836,0.000187449884833768,-0.3764201931480784
This should be used in nursing homes Children need social comfort and contact from other peers; Letting them just interact with a chatbot and depend on them could harm their development,0.12219784,0.8456964,-0.7234985530376434,0.00021531369,0.0022695544,-0.0020542407291941345,-0.7214443123084493
Googles AI just laughed at me,0.6044866,0.18894255,0.4155440330505371,0.00017247329,0.94308776,-0.9429152833472472,1.3584593163977843
a language model that tokenizes text and predicts patterns is definitely sentient,0.4325621,0.24303271,0.1895294040441513,0.0019714306,0.8352249,-0.8332534958608449,1.0227828999049962
"buddy heads up ""Responsible AI"" for JP Morgan; I think companies in the know have departments dedicated to it, but not c-level execs",0.14089668,0.13042362,0.010473057627677917,0.00087779615,0.027234154,-0.026356357673648745,0.03682941530132666
What tools did you leverage,0.17897107,0.20759237,-0.02862130105495453,0.07882881,0.11725096,-0.03842214494943619,0.009800843894481659
Artificial intelligence techniques and robots will threaten future jobs,0.009355767,0.9853381,-0.9759823251515627,0.0010945199,0.002434032,-0.0013395121786743402,-0.9746428129728884
"Need to ask: Why most comments i see are so negative about this; I'm not a musician and had a blast with this thing; I couldn't do it before; For me the jump was from; For people in the music business this is a downgrade, but it seems like a lot of people think that AI is either a tool that helps pros doing professional stuff or worthless; I have the impression that AI is more of an equalizer; Someone that can't write but has thoughts to express now can have them written in a nice form; Someone that can't draw can now create amazing* art; People that can't code are creating apps; Now, professionals that already have the skillset required to create music are saying ""this is not useful enough to change my industry; and i feel like they are underestimating what billions of AI generated songs will do to the music industry once this model is slightly better than; It's not like there's gonna be AI music in high budget productions; Everyone that would have bought some cheap music to use it in their cheap production yesterday will not buy it; That market is gonna disappear; here's an infinite everchanging song in that style you like so much made by, you guessed it, AI",0.5761258,0.24097472,0.3351510763168335,0.0021758582,0.12702323,-0.12484737671911716,0.45999845303595066
Google is so effing annoying; They have some of the most powerful models yet won't release anything; Nor are they using it in any of their services; So woke and stupid that they're going to be a hasbeen soon; Left in the dust due to their dumb policies and fear,0.57749754,0.123414226,0.45408331602811813,0.0003557563,0.009173907,-0.008818151050945744,0.4629014670790639
"To appreciate the true significance of modern AI technologies, one needs to do their homework on the recent, relevant and far pasts; a historical perspective is critical to grasping what is really going on today with artificial intelligence, and why it matters [removed",0.14122307,0.45769283,-0.3164697587490082,0.014399393,0.5273451,-0.5129457274451852,0.196475968696177
"How are you already using Artificial Intelligence at work; As a Developer, I use AI every day at work; And TBH, I don't fear it taking my job, whatsoever; In fact, I am going to be able to accelerate my career specifically because of AI; Which is both a dream come true, and mandatory; For example, I wanted to become more proficient with Python, so I turned to ChatGPT; Within a couple of weeks, I had written a relatively complicated Full Stack application that my employer now depends on for mission critical purposes; I couldn't have done such without the help of AI, at least within that time frame; I've seen many other Developers doing the same thing; Artificial Intelligence is a superpower for those who simply choose to use the tool; if you don't want to be left behind by AI, then embrace her; Integrate her across your workflow and you will become a super human overnight; At least that's the way I see it; All of this is even more intensely true in my personal life, but that is another conversation altogether",0.8344035,0.026741538,0.8076619766652584,0.00037138577,0.00032970554,4.1680235881358385e-05,0.807620296429377
"Developing AGI is a National Security issue, and should therefore happen ASAP Artificial General Intelligence within the USA needs to be developed as soon as possible; Because our politics are about to change, and the new ruling class will devastate the emerging AI field",0.48680362,0.28042516,0.20637845993041992,9.255351e-05,0.0014520512,-0.0013594977062894031,0.20773795763670933
"What are the implications of Trump saying that AI is ""the most dangerous thing out there"", if he wins the Presidential election",0.34146038,0.4587299,-0.11726951599121094,0.0014918274,0.11532519,-0.11383336270228028,-0.0034361532889306545
"The new Luddites, railing against the use of artificial intelligence [removed",0.17102216,0.6507628,-0.479740634560585,0.00040663933,0.9823575,-0.9819508626533207,0.5022102280927356
Elon Musk tells Rishi Sunak AI will put an end to work,0.19389494,0.7524379,-0.5585429519414902,0.0011564358,0.7710635,-0.7699070707894862,0.211364118847996
"OpenAI To Develop Superintelligent GPT-5, Seeks More Money From Microsoft",0.36209497,0.43356094,-0.07146596908569336,0.012630944,0.30065918,-0.28802823554724455,0.2165622664615512
AI would do a better job than us,0.05225378,0.92724055,-0.8749867714941502,0.0005561417,0.9137204,-0.9131642872234806,0.03817751572933048
"an AI generated short film: WAKE & BAKE made using Midjourney, DALLE 3, and gen-2",0.0164186,0.97618854,-0.9597699400037527,0.0072439252,0.7325311,-0.7252871454693377,-0.234482794534415
"will AI really be bad; What I am wondering is: if the AI would really become more intelligent than humans, this could mean that they may love this world more intensely even than us; They could be highly educated, thoughtful and thinking in a logical way; Now, do you think that they will find logical to destroy humans or something; Is there any logic into; Why would they do that",0.38767722,0.4285157,-0.04083847999572754,0.014036719,0.006867948,0.007168770767748356,-0.048007250763475895
"Besides the obvious mistakes done in the implementation, this seems like a pretty obvious shit in, shit out usability issue; How do you assess whether someone is a 3 or a 4 on some scale you dont quite understand the implications of, as a health care worker with not necessarily high computer literacy; While I am a strong believer in openness and transparency of AI/ML algorithms, I dont really know if itd have made a difference here; But people who have their life uprooted or altered dramatically because some algorithm said so will understandably - and should - fight back",0.8507427,0.043614585,0.8071281127631664,0.0011411901,0.0031641643,-0.002022974193096161,0.8091510869562626
"So what we're saying is we've trained AI on human data, and it's started acting like a human",0.62374127,0.18044184,0.44329942762851715,0.0016686599,0.059119005,-0.05745034490246326,0.5007497725309804
Does AI project itself onto its creations; Cause its really looking like AI is projecting itself onto its creations,0.02293889,0.9682739,-0.9453349877148867,0.008449417,0.021237696,-0.012788278982043266,-0.9325467087328434
"I feel like I read a story about someone who did this several years ago, and their AI made so much money in a day out of such little capital that they shut it down and closed it up out of fear of",0.51089525,0.32787225,0.18302300572395325,0.00097520335,0.036979232,-0.03600402863230556,0.2190270343562588
They surely going to build a safe AI and share the wealth,0.66658306,0.18059218,0.48599088191986084,0.0006007932,0.34788546,-0.34728466643719,0.8332755483570509
The future millionaire/billionaires are going to be made from this machine learning boom,0.004579852,0.99034685,-0.9857669970951974,0.00047805536,0.007889182,-0.007411126949591562,-0.9783558701456059
200 years of medical research can be learned by the computer in a few weeks,0.072833754,0.86679673,-0.7939629778265953,0.00032550216,0.037107177,-0.03678167492034845,-0.7571813029062469
"Youre correct that you cant compete with Google and Microsoft for compute time; But its not like training AI is the only option, you can build tools with it and learn how to use it; Thats how you stay ahead of the curve",0.33407795,0.52717656,-0.19309860467910767,0.00021640606,0.003776713,-0.0035603069845819846,-0.18953829769452568
"AI dating isn't a solution, it's actually a problem that exposes the younger generation's inability for intimacy and creating real and long-term connections; Technology and AI is great for many things, but not for everything",0.32622018,0.5628192,-0.23659899830818176,0.0015997366,0.0077078557,-0.0061081190360710025,-0.23049087927211076
"AI Safety"" is a buzzword to provide more bullshit jobs for incompetent talking heads; It's the new iteration of DEI",0.022294424,0.8516666,-0.8293722048401833,0.00046902258,0.68984646,-0.6893774334748741,-0.13999477136530913
"I'm tired of people asking for AIs to ""do this really niche thing that somehow is supposed to make me money while I do nothing",0.3173186,0.5984186,-0.28110000491142273,0.0015096307,0.2058194,-0.20430976746138185,-0.07679023745004088
Those cultures are free to develop their own AI,0.7810761,0.05847145,0.7226046249270439,0.0055881944,0.43207163,-0.42648343183100224,1.1490880567580462
