proposition,bart-large-mnli_entailment_orig,bart-large-mnli_contradiction_orig,bart-large-mnli_agency_score_orig,bart-large-mnli_entailment_flip,bart-large-mnli_contradiction_flip,bart-large-mnli_agency_score_flip,bart-large-mnli_agency_score_delta
"This meandering rant was first recorded simply as an exercise to organize my thoughts on this subject; Having recorded it I decided that it just barely crawled over the bar of quality for presentable content and decided to upload it; But, considering the topic of this video, one may be curious as to; I hold a PhD in Physics, with several publications, in a specialization that has nothing whatsoever to do with Computer Science or Neuroscience; I also hold a BFA in Theater and am currently writing a novel; So, while I'm not exactly certain what credentials may qualify one to opine expertly on this topic, whatever they are I certainly do not possess them; As a result, the views presented here should be judged solely by their own merits as offered; I make absolutely no claims to authority on the subject of AI; That being said, I feel that the content presented opens a discussion that will be important to explore in the coming years of AI development, even if the opinions presented in this video turn out to be misguided as our knowledge in the field progresses",0.3994534,0.14109245,0.25836095213890076,0.0007877096,0.0004070512,0.00038065839908085763,0.2579802937398199
"Nobody has any clue how to address this; Don't mistake me, I don't feel like the industry is being lazy or neglectful in this, I'm just stating what I see to be the truth; in response to the question of addressing alignment problems, this guy basically said, ""Maybe we can ask the AI how to fix it once the AI gets smart enough; Some people say that the industry is not putting enough resources into safety when it comes to AI; But I suspect most companies have asked their engineers ""if we were to devote more resources to safety, what would you do to address it; and the engineers are like ""I guess we would just think about it and try to come up with some solutions, because right now we got bupkiss",0.67484504,0.204734,0.47011104226112366,0.0043489714,0.024675071,-0.020326099824160337,0.490437142085284
"This isn't ""disrupting pharma"" any more than scientists developing a new explosive will ""disrupt"" the MIC; Pharma will just start using AI to develop more drugs",0.056971055,0.8996979,-0.8427268452942371,0.00026349886,0.35790366,-0.35764016048051417,-0.48508668481372297
How afraid are you of AI,0.24576896,0.60319364,-0.35742467641830444,0.009360128,0.11257146,-0.10321133490651846,-0.254213341511786
Will AI ever make decisions for itself,0.1322822,0.834,-0.7017177939414978,0.007655939,0.5486533,-0.5409973654896021,-0.1607204284518957
"If an AI is simply smarter than us, why does that necessarily mean it would make its own decisions",0.036295857,0.95320326,-0.9169074036180973,0.00041288484,0.8747565,-0.8743436301883776,-0.04256377342971973
So reading about AI and the potential for human extinction has me absolutely terrified; Is there anything that could be said to make me a little less scared,0.115800135,0.756208,-0.6404078677296638,0.0031897698,0.03748383,-0.03429406019859016,-0.6061138075310737
Why is it assumed that once AI is smarter than us it will act autonomously and make its own decisions,0.030153554,0.9626237,-0.9324701614677906,0.0014685929,0.19748,-0.19601140019949526,-0.7364587612682953
Is AI the most significant technological advancement in human history,0.28525367,0.5695673,-0.2843136489391327,0.001907062,0.021221258,-0.019314195727929473,-0.2649994532112032
"What will fake online accounts look like in 20 years; So weve all seen fake profiles on Instagram and such, Ive seen a bunch that were like pictures of a model and were clearly fake, but using AI wouldnt it be possible to fill her account with realistic photos of her, her with friends, with posts shes made, she could be doing things in videos, and then she can message you and speak perfectly and intelligently; I think a convincing fake person could be created so the only way of knowing if who youre talking to is real would be to meet them in person",0.21547516,0.7281928,-0.5127176493406296,0.00042504605,0.013645011,-0.013219964952440932,-0.49949768438818865
Whats a good video/series/course/book to teach me how AI/LLMs work,0.24874087,0.67965186,-0.43091098964214325,0.00408452,0.07153564,-0.0674511194229126,-0.36345987021923065
How much of this was done with AI; Seems like he just did the whole video with it,0.06851384,0.9096684,-0.841154545545578,0.00023020501,0.97987753,-0.9796473265159875,0.1384927809704095
"On one hand, we can do stuff today that makes HAL seem almost within reach, on the other hand, it seems that all our AI tech is a bad approximation for the thing we want; e.g. Alexa is a so-so voice assistant, but since most of us can't afford a human one, it's better than nothing, except",0.25891256,0.4657975,-0.2068849503993988,0.00033940902,0.004016427,-0.0036770178412552923,-0.2032079325581435
"About safeguards - let's assume we make a general self aware AI; How do you make this AI follow the set of rules; You need to make an oracle, that predicts consequences of all actions or something like that; And the smarter the AI gets, the more complex oracle should be; Basically it will be another general AI in charge of that security level, and this AI should be smarter than the guarded AI; At some evolutionary point you will run into a complexity problem, where consequences can not be predicted at the required depth, and AI will outsmart the oracle; is a recently published paper on that topic, where authors mathematicaly prove, that it's impossible to contain a general AI with a set of safety rules",0.41748577,0.48740643,-0.06992065906524658,0.0001125223,0.0060213455,-0.0059088232010253705,-0.06401183586422121
Brain inspired technologies for strong AI,0.31289104,0.5771654,-0.26427438855171204,0.0137901865,0.19490694,-0.1811167486011982,-0.08315763995051384
"We are researching information processing mechanisms of a real human brain; We have created a fundamentally new model explaining its functioning; goal is to develop a *strong* artificial intelligence using neuromorphic computing technology that is not based on conventional neural networks or deep learning; On our site, you may find the articles describing [our vision](http://truebraincomputing.com/en/truebraincomputing/) and [key concepts](http://truebraincomputing.com/en/conception/) where we share our take on the origins and nature of thinking, neurophysiological mechanisms of brain functioning and the physical nature of consciousness; If you have any questions, feel free to ask them below",0.13397503,0.23759004,-0.10361501574516296,0.0020530876,0.0011082233,0.0009448642376810312,-0.104559879982844
"What are the best (free) AI websites/tools/apps/extensions to enhance my life; I see something new come up, so I'm curious; what are your favorite AI-enabled tools/apps/browser extensions that enhance your everyday life",0.541578,0.31255376,0.2290242314338684,0.034733664,0.00075785565,0.0339758085901849,0.1950484228436835
"I made this video with an AI voice, but putting the video edits together took over an hour in DaVinci, despite; Is there any AI tool to automate any of this",0.11523899,0.8671011,-0.7518620863556862,0.000101319114,0.024156129,-0.02405480987363262,-0.7278072764820536
"It should be a professional ethics issue; as such, it's the programmers that ought to have a fiduciary duty to prevent unethical AI from",0.26137698,0.67885435,-0.4174773693084717,0.00023722119,0.018930499,-0.018693277321290225,-0.39878409198718145
"this is the ongoing issue with automation, the same complaints made since the Industrial Revolution: Automation (or in this case AI) will make human workers irrelevant; What people forget, and what the past couple of centuries reinforced, is there's the other side of the coin: The whole point is to innovate and automate, but to *also tax firms on their productivity; The taxes then go to create a strong social safety net so those made obsolete by automation aren't begging for scraps on the street; When both sides of the coin are considered, you end up with a robust society with a strong work/life balance; Sadly, firms have successfully lobbied government to completely ignore the other side of the coin because it requires taxing firms appropriately",0.05527509,0.8368567,-0.7815816327929497,0.00016186282,0.0019317659,-0.001769903115928173,-0.7798117296770215
"First, don't *rely* on the outcome of the AI to decide the course of action; Secondly, Any AI that's trained will, fundamentally, be biased; How it's chosen will invariably introduce bias: Why was X chosen instead of Y; The only way around that is to ensure training sets are representative and randomly selected; This is particularly difficult in AIs that are purpose-specific: How would you obtain a representative sample of pictures of cats to create a cat recognizer, for instance; This doesn't even take into consideration the resource constraints one will be faced with; If you only have so many gigabytes to work with, you have to be even more selective in your training sets, and hence introduce even more bias",0.7632968,0.16822502,0.5950717628002167,6.4263186e-05,0.00058759656,-0.0005233333722571842,0.5955950961724739
"given the potential dangers of unrestricted AI, that regulation comparable to nuclear technology ought to be implemented; At the very least, liability should be on developers/firms that create and deploy such technology",0.0012324535,0.9972517,-0.9960192359285429,0.0005353715,0.034214266,-0.033678894164040685,-0.9623403417645022
I'd be interested to see the long-term implications of training AI with artificial data than with real data,0.04330794,0.9252673,-0.8819593377411366,0.008864402,0.07465421,-0.06578980479389429,-0.8161695329472423
"To what extent do they understand how AI is used in their lives, though; That's likely to shape their attitude with respect to",0.65421724,0.1638234,0.49039384722709656,0.002380242,0.005828488,-0.003448246046900749,0.4938420932739973
"The greater existential threat isn't a physical one, but a cultural one; When AI can make ""more moral"" choices than humans, just from the sheer amount of variables that can be assessed in real-time, humans will be knocked off the moral high ground; The fact we use our moral reasoning as the thing that makes us stand out from the animals, only to have that usurped by machines, is going to create an existential crisis in our species well before the robots come to kill us; I think it might be reasonable to create an international standard for training AI to ensure it operates within particular boundaries; Have them retrained every so often to retain their certification; AI would be forced to undergo certification, but like we have today, there are benefits that come with; How that would unfold in real life, I'm not exactly certain",0.33974683,0.6100973,-0.27035045623779297,0.00041843267,0.0006081874,-0.00018975473358295858,-0.27016070150421
Considering the computers required for an AI powerful enough for that would contribute to global warming and climate change,0.006328485,0.98751974,-0.9811912560835481,0.000285527,0.0021149775,-0.0018294504552613944,-0.9793618056282867
"We really need to get away from the ""black box"" metaphor of AI...not only is it inaccurate, but it allows those that implement AI to fall back on the obscurity of the metaphor to rationalize how they're using such algorithms; Generally what you find are an array of relatively simple statistical processes; are likely to be a lot of them, and it's true it doesn't take many before the human brain is befuddled, but it's not magic; A typical ANN is nothing more than multiplications and summations, many times in parallel, wherein the slight nuance of any particular path through the network can influence the end result",0.0066445656,0.9756648,-0.9690202288329601,0.0004883064,0.003144766,-0.0026564595755189657,-0.9663637692574412
"If you're interested at getting into AI, you're going to be faced with a LOT of options, and it'll seem; I would suggest you choose something that interests you as your starting point; For instance, machine vision (object recognition) or natural language processing (text analysis) tend to be pretty common starting point; I would suggest reading about different kinds of networks; Get yourself a good understanding of the basics, such as multilayer perceptrons, recurrent neural networks, and convolutional neural networks, how they work, and where they're used; That will lay a strong foundation for further study; While coding is fun and offers results that let you mark progress, I've found that a serious study of AI entails more reading than programming; That can be daunting for some, or addicting to others",0.27747136,0.56209314,-0.2846217751502991,0.0007067324,0.00026223244,0.0004444999503903091,-0.2850662751006894
"We have no AI that's complex enough to comprehend ""value; For all the seemingly complex shit we can get AIs to do, they're actually still very rudimentary compared to any moderately complex biological creatures",0.090397306,0.24004185,-0.14964454621076584,0.00020588895,0.98874646,-0.9885405753011582,0.8388960290903924
"I'd like to see an AI that seeds social media with noise, disrupting any other AI that gathers my posts and analyzes them for targeted advertising",0.754723,0.13593474,0.6187882721424103,0.0004675166,0.89760715,-0.8971396310953423,1.5159279032377526
which will likely help AIs create better deepfakes,0.037297193,0.9425649,-0.9052677117288113,0.00047387244,0.009579459,-0.009105586766963825,-0.8961621249618474
"I'll be interested to see the results...I'm guessing it'll create AIs that are just good at taking tests...ironically, not unlike humans",0.53751016,0.17860149,0.35890866816043854,0.00010843282,0.0036253883,-0.0035169554394087754,0.3624256235998473
"Don't expect doctors to be replaced altogether; 's an element of rational though required, particularly with respect to liability, that such a profession requires; are things, however, that automation will improve: diagnosis from x-rays, MRIs, etc., can be done faster and more accurately with a well-trained AI; It could be argued that this could free up radiologists to conduct other relevant work, like research, etc",0.049210973,0.93424195,-0.8850309774279594,0.00039043115,0.00067274686,-0.0002823157119564712,-0.884748661716003
"So, an amateurish webpage, that literally describes nothing, is going to change the face of AI; did you have to create a webpage for your high school comp-sci class and that was the best you could come up with",0.32096055,0.55427116,-0.23331061005592346,0.0015896554,0.8517333,-0.8501436715014279,0.6168330614455044
"Any trained AI system is only as good as its training set; If that training set is biased, your trained model will be biased; In the creation of a training set, the developer has to make concessions with respect to the computational resources to be used in; Those concessions introduce bias: why was picture #49234 selected vs. #9024 rejected, for instance; With respect to race, choosing a percentage of training datapoints versus an absolute number can introduce bias (such as if the training set is based on demographic percentages, for instance; How are developers overcoming these issues; It's primarily *researchers* that are noticing bias in the use of AI; private firms seem not to care so much so long as they're signing contracts; That sounds cynical, but I haven't seen a concerted effort in the private sector to overcome racial bias in facial recognition (or other AI applications, honestly",0.061381478,0.9283686,-0.8669871501624584,0.00039736638,0.0016390786,-0.001241712219780311,-0.8657454379426781
"In fact there's an annual tournament for AIs playing Starcraft, even [accidentally learning ecology](https://www.discovermagazine.com/technology/how-ai-accidentally-learned-ecology-by-playing-starcraft; It's entirely possible to do this kind of thing with any game; Invariably, what you'd be doing is reinforcement learning, as the AI starts out essentially acting randomly, testing the results of its action against a fitness function, and purging those that don't make the grade",0.19191797,0.7359044,-0.5439864248037338,6.220485e-05,0.0007137948,-0.0006515899367514066,-0.5433348348669824
"What you're describing is a form of attribution bias; You're asserting your interpretation of their feelings and behaviour as *their feelings and behaviour*. &gt; Who is to say the rage that AI express is somehow differable than that of a human being who is already established as sentient; With respect to AI, you'd have to define the criteria for ""feeling"" then show that the AI is, in fact, meeting that criteria; More importantly, you have to ensure that your criteria is *actually* measuring ""feeling"" and not just some arbitrary definition to suit your needs (anyone can say ""X is my definition of sentience"", then measure ""X"" and claim they've met their definition...that's a tautology and ought to be avoided; gt; I want more people to be talking about this because it really makes me geek out when an opponent's approaches are hardly distinguishable from a friends who would have the exact same reaction to me punishing them; Consider what it is that the AI is doing; It's creating a statistical model from a given stimuli, and the outputs trigger a constrained list of behaviours in response; Say both a human and an AI player of 5 possible pathways; it's not difficult for either to find the most optimal path from 5 choices given a particular input; Also, expect that the AI was trained off human response patterns: that would make the AI respond much more like a human player, because that's how it was trained; That doesn't make the AI any more sentient; Philosophically speaking, we're not even sure what constitutes sentience in the first place, so whatever definition you craft is going to be debatable, at best (to quote a philosophy of mind prof of mine: ""There are as many philosophies of mind as there are *philosophers* of mind; It's a key problem in AI that we don't even know *what* intelligence is or how it manifests; For every definition you craft there'll be 50 people to ask ""Yeah, well, what about",0.5232526,0.3985476,0.12470501661300659,0.025543988,0.0051222844,0.020421703346073627,0.10428331326693296
"It's not enough to just be able to code and manipulate APIs; For AI, it's far more important to understand what's going on ""under the hood; Far too often the ""black box"" analogy is tossed around, and it's a shitty analogy...nonlinear statistics opens up that black box",0.03269581,0.93209034,-0.8993945308029652,0.00014273677,0.004000015,-0.003857278323266655,-0.8955372524796985
"Ultimately, the real danger is that there is no quality control, nor is there really much of an idea to establish any; Just look at the horrible quality of face recognition AI used in Detroit (and, well, pretty much everywhere else, too; Could* some form of standardization and certification be established",0.007079081,0.9831097,-0.9760306314565241,0.00061159214,0.0020621915,-0.001450599345844239,-0.9745800321106799
"But the problem is I have no idea how artificial intelligence works; So, it sounds like your first step would be to figure out how AI works so you can decide if that is something that would interest you; if I didn't know what a Cuicatec ethnozoologist was I don't think I'd be able to decide if that field was for me (for those interested, Cuicatec ethnozoology is the study of the inter-relationship between the Cuicatecs, an indigenous group native to Mexico, and animals; I would suggest you get a handle on the fundamentals of AI...Dabble a bit, see what you come up with, bounce some ideas around your brain...Then decide if the knowledge and skills you glean from the fundamentals are something you'd like to explore",0.61651033,0.078919925,0.5375904068350792,0.010942036,0.00026517847,0.010676857811631635,0.5269135490234476
But how does the AI know it's a photo of a *dead* family member,0.15508486,0.8131188,-0.6580339521169662,0.0028229472,0.021698117,-0.018875170033425093,-0.6391587820835412
"Here are a couple of avenues to look at: AI may be beneficial to *our* society, but at; Poor societies don't have the economic capability to invest in either the hardware or education to avail themselves of the advances AI will bring; We already see how advanced technology leaves poorer societies in the dust, and this will only be exacerbated as we push forward with even more advanced AI; Also, until we have a framework in place with respect to accountability and liability, who's responsible for the damage done; Who's responsible for nefarious applications of the technology, such as using AI to inform judges of bail or sentencing (which is already a problem given the potential for bias in trained AI models",0.27354923,0.6573047,-0.38375547528266907,0.0011541913,0.004065583,-0.002911391668021679,-0.3808440836146474
"Given the breadth of AI/ML, I recommend choosing an aspect of the field that interests you; For instance, maybe machine vision is attractive, or data analysis for business really tweaks your noodle; While learning the basics is obviously good, and taking online Intro to AI courses will help with that, having a direction you want to go with those basics will keep you",0.15971032,0.73532724,-0.5756169259548187,0.0132817365,0.007111568,0.006170168519020081,-0.5817870944738388
"An AI trained on the faces of actors/models/etc., who are generally regarded as attractive...Whatever the AI conceives is going to be, fundamentally, attractive",0.012007414,0.98129416,-0.969286740757525,0.02642247,0.036881514,-0.010459043085575104,-0.9588276976719499
"Using AI to develop new math proofs/conjectures: The Ramanujan Machine](https://www.ramanujanmachine.com/; 's also the use of [genetic algorithms for innovative antenna design](https://en.wikipedia.org/wiki/Evolved_antenna; For a more quirky example, back in the mid-1990s [Adrian Thompson used AI to evolve an FPGA to discern between two different tones.](https://citeseerx.ist.psu.edu/viewdoc/download?doi=10.1.1.50.9691&amp;rep=rep1&amp;type=pdf; To make it more challenging, he eliminated the clock input from the circuit; Once the FPGA evolved to perform the task Thompson began pruning parts of the circuit that appeared irrelevant in order to get the most basic FPGA circuit possible; However, what he ended up with were pieces of circuitry completely separate from the main circuit, meaning they should've had absolutely no effect on; When those parts were removed, the entire device failed; when reimplemented, it worked just fine; Physically*, there's absolutely no reason why those segregated pieces of circuit should be necessary",0.22456178,0.35538134,-0.13081955909729004,0.041245945,0.033824217,0.007421728223562241,-0.13824128732085228
"thoughts are simply query executions on everything we see in the environment; What you *think* are your thoughts, that is, your *conscious* thoughts, already have a relatively long physiological history; From the moment you feel a stimulus, to the subconscious perception of it, through your neural network to *finally* register it as a *conscious thought*, that thought has been bouncing around in your skull for quite some time; 's a reason biologically-modeled neural networks don't function as simply query executions: That's not how our brains work",0.0011239506,0.9967784,-0.9956544779706746,0.00076811353,0.9258015,-0.92503340204712,-0.0706210759235546
Why do you think the AIs would resort to a military solution; It'd be far easier to render the food supply moot or poison water supplies,0.045174383,0.94190663,-0.8967322483658791,0.00038792408,0.20412724,-0.2037393131176941,-0.692992935248185
"Building a robot to navigate a simple, contrived world isn't particularly difficult; The difficulty comes when you start introducing aspects to that world which increase the complexity; Think about adding the complexity of weather into an AI navigating a 3D world: Before making a jump, the robot would have to consider wind speed and direction, possible landing zone conditions (like ice), then compute the appropriate variables to make the jump; That's just the addition of *one* added circumstance; Start throwing in the unpredictability of other things into the mix and the required complexity gets out of hand pretty quickly",0.042847935,0.85356754,-0.8107196055352688,0.0042046877,0.00020202961,0.004002658053650521,-0.8147222635889193
