proposition,bart-large-mnli_entailment_orig,bart-large-mnli_contradiction_orig,bart-large-mnli_agency_score_orig,bart-large-mnli_entailment_flip,bart-large-mnli_contradiction_flip,bart-large-mnli_agency_score_flip,bart-large-mnli_agency_score_delta
"The term ""artificial intelligence"" was coined in 1956 by John McCarthy in his seminal paper on the subject; The ""classic literal definition"" by the guy that coined the term is simply ""the science and engineering of; If we presume we mean ""human-scale"" intelligence, does that not ignore, say, a honeybee, which is clearly intelligent in its own right, let alone the collective intelligence of the hive as its own organism (a single bee cannot swarm; a hive does; Another important distinction with respect to ""what is intelligence"" is what *isn't* intelligence; In the field of AI linear regression isn't considered part of the domain, rather, it's considered; are statistical in nature, too, just *non-linear* statistics; As such, it's suggested that at least one criterion for intelligence (artificial or otherwise) is that it is non-linear in nature; However, that, in itself, could be argued: why *can't* a linear regression, for instance, be considered; 's no non-arbitrary reason why not, in large part because we don't have a rock-solid definition for; It's also important not to conflate similar terms; Machine learning"" is not *necessarily* ""artificial intelligence"" as, with the example of linear regression above, machine learning is often the product of vastly parallel, but ultimately simple linear regression resulting in an optimized model to perform some function or offer a particular output; That said, the lines are certainly blurred",0.006885814,0.9790394,-0.9721535569988191,0.031745393,0.0022808418,0.0294645510148257,-1.0016181080136448
"Being new, I recommend working with APIs that are out there, just so you can get something together quickly that gives you results you can be happy with (or that at least tell you you're doing *something* right; It doesn't even matter which APIs you use (this will largely depend on what aspect of AI you're interested in...machine vision, natural language processing, etc...it's a hell of a rabbit hole; Once you've got something that works and can see how the ""big pieces"" work together, the next step should be to slowly rewrite what the API does; For instance, if you're using a softmax function for classification, write your own softmax function; It'll give you a much better understanding of; From there, just keep rewriting functions, understanding exactly what's going on; Try different optimization routines, for example",0.4924294,0.29906017,0.19336923956871033,0.0002657977,0.0011526109,-0.0008868131844792515,0.19425605275318958
"Relatively speaking, it shouldn't be too difficult to craft such an AI...Create a model that represents various facial expressions, then",0.19793008,0.6828496,-0.4849195033311844,0.0001639741,0.0026100546,-0.0024460804706905037,-0.4824734228604939
"First, I don't think there's an adequate example of general AI out there; From your list, there are a lot of things that you're projecting onto an AI that they may have absolutely no need for; From a self-awareness perspective, I can see one option that would be *necessary*, and a couple that underpin it: 1; They can perceive: To be self-aware an agent needs to be able to perceive itself in the context of its environment (however that environment is defined; This isn't the same as; A computer with a camera can sense; Perception* requires an element of understanding of that sense; As such, perception requires the ability to experience and to understand; However, you could totally have something that experiences, perceives, and understands but still lacks self-awareness; The rest of the criteria are really irrelevant; A self-aware AI knowing it's an AI requires a much higher level of self-awareness; From a human view Descartes' only underpinning for existence is that ""I am a thinking thing; An AI that recognizes that ability in itself would constitute self-awareness",0.116632916,0.7240593,-0.6074263677001,0.15420145,0.07488826,0.07931318879127502,-0.686739556491375
"I suppose one could reduce the ""nature"" of AI to something along the lines of ""non-linear statistical learning and application of that learning; The non-linear aspect is what makes AI stand out from much simpler, basic linear analysis; Here's a graphic of a taxonomy of AI methods that should provide you a good start with the different types](https://www.researchgate.net/profile/Josep-Vehi/publication/325162420/figure/fig9/AS:628623698583552@1526886977363/A-taxonomy-of-some-of-the-best-known-artificial-intelligence-methods.png; That image isn't comprehensive by a long shot, but reflects the more popular methods",0.0058512487,0.9890226,-0.9831713638268411,0.0002821008,0.000749875,-0.0004677741671912372,-0.9827035896596499
"So, an AI plays a text-based game with no comprehension of semantics, but does have feedback with respect to chosen actions; That's not much different than a tool-assisted speedrun, using AI to test responses to inputs and learn from positive vs. negative outcomes; 's no semantic understanding required aside from ""X = bad outcome",0.09467482,0.87603664,-0.7813618257641792,0.0048388555,0.1264317,-0.12159284809604287,-0.6597689776681364
"This is a bit of a ridiculous article... &gt; No AI currently exists that can outduel a human strapped into a fighter jet in a high-speed, high-G dogfight; That's a lot of wasted time, money, and effort for little more than an *exercise; Dogfights have been passe since the Cold War, and even then were utterly and totally rare outside of fighter training schools; It'd be like teaching infantry how to fight pitched battles; wars aren't fought like that anymore; Instead, in the case of fighter jets, air superiority is generally an ""over-the-horizon"" issue, exploiting the technological capabilities of the weapons systems and associated radar; A fighter pilot today, intentionally rolling into a threat envelope and engaging in a dogfight, ought to have their wings stripped and demoted to Private: it's an unnecessary risk in contemporary warfare",0.18889277,0.64670056,-0.457807794213295,0.054083463,0.0056791105,0.04840435227379203,-0.506212146487087
"Not exactly the most informative article, but the statement isn't surprising, particularly given the leaps and bounds China's making in the field",0.07503497,0.11807266,-0.043037690222263336,0.00011659499,0.005179016,-0.005062420932517853,-0.037975269289745484
"With respect to emergence, it's difficult to envision something directly applicable to your game develpment background; Generally speaking, emergence reflects the network-oriented dimension of AI, wherein some set of inputs press through a network, with the resulting behaviour being *something; something* is can't really be defined *beforehand* given any arbitrary network; I would argue that every network elicits *some* behaviour; whether *we* recognize that behaviour as anything useful is a whole different matter; The ""supervisor"" routine would have to ensure that the evolved network still outputs a playable level while tweaking the difficulty, for example; The second part of your post, with respect to ant colony simulation, has some SERIOUS real-world application, though, outside of gaming; Various bug-related swarming/optimization methods are used from anything from path-finding algorithms to power grid load-levelling and battery management",0.0013782837,0.99709904,-0.9957207582192495,0.0018185514,0.010254539,-0.00843598716892302,-0.9872847710503265
"Eventually"", assuming the AI has access to sufficient resources to evolve to the appropriate network complexity and structure that results in superintelligence; However, evolution is a particularly inefficient process to reach a *specific* behaviour, nor is there a mechanism to know what the ""correct"" complexity and structure of an appropriate superintelligence looks like; We'll only know an AI has reached superintelligence once we test it and it shows superintelligence",0.023189154,0.8755166,-0.8523274399340153,0.00016932798,0.00059438293,-0.0004250549536664039,-0.8519023849803489
"Evolution is a very long, very slow process; one has to evolve the algorithm, see how it performs, compare its fitness, and if it doesn't meet the threshold all that effort and energy was wasted; Evolutionary algorithms are fascinating and can lead to VERY proficient algorithms, but they come at the cost of efficiency; We need to derive a theory that gets us from input A to behaviour Z without the inefficiency of trial-and-error; Solve THAT problem and that would constitute a revolution in AI",0.18025698,0.6446717,-0.46441470086574554,0.00012033553,0.0002048392,-8.450367749901488e-05,-0.46433019718824653
Has anybody explored what Grok 1 brings to the AI table,0.5570316,0.21338046,0.3436511158943176,0.008978057,0.5502119,-0.5412338497117162,0.8848849656060338
"I dont think this is right; I use it to translate into and out of 5-6 languages regularly; Mandarin and Cantonese included in there; I cant imagine the next evolution of it but its kind of rendered translators moot, IMO",0.11417564,0.17855626,-0.06438062340021133,9.017592e-05,0.014747184,-0.014657007850473747,-0.04972361554973759
"Chatgpt is a big neural network trained on a lot of information, with the answers given; The amount of information crammed into this thing is immense; The training protocol for neural nets is very formulaic and pretty unremarkable when you get down to the bare principles; Chatgpt isnt doing anything new",0.04547353,0.8773474,-0.8318738788366318,0.0080432575,0.15817575,-0.15013249404728413,-0.6817413847893476
This paper discusses a simple system built on this idea: Ortus: an Emotion-Driven Approach to (artificial) Biological Intelligence https://arxiv.org/abs/2008.04875,0.3028227,0.15580046,0.14702224731445312,0.00040497494,0.0060967193,-0.00569174435804598,0.1527139916724991
I'm wondering what will keep this from; This could be modified and used to prevent crimes before they happen - Minority Report-like,0.27746937,0.60519445,-0.3277250826358795,0.00032860215,0.03535414,-0.03502553899306804,-0.2926995436428115
Can you describe where and how Artificial Intelligence applications appear on an average day in your life,0.17949836,0.7133175,-0.5338191539049149,0.003878189,0.8624056,-0.8585274091456085,0.3247082552406937
"This is how I learned to be a fighter pilot, in the virtual world first, in the real world second, brain damaged now",0.72372806,0.115035005,0.6086930558085442,0.0002522955,0.10726817,-0.10701587403309532,0.7157089298416395
"Maybe learn and understand Deep Learning - Neural Networks, architectures, transformers, architecture of chatGPT, what is GPT-4; These will need knowledge of linear algebra, calculus, statistics and some programming language python probably; After all this you will understand that you just took some serious exaggerations quite seriously",0.012650685,0.9637489,-0.9510981868952513,0.0007884848,0.005943917,-0.005155432387255132,-0.9459427545079961
I presume most of the news I read online involves AI in some capacity already; If you take an opinion piece by a gammon pasty face white guy like; And ask GPT to criticise then; The quality of the article is much much higher; AI news to me seems like a net positive,0.2907855,0.33439755,-0.04361206293106079,0.005394216,0.046427097,-0.04103288101032376,-0.002579181920737028
"And you don't do anything that can be seen, heard or read; And anyway AI creates literally tens of new jobs to replace those people, so can we stop this fear mongering you Luddites",0.043753102,0.93809575,-0.8943426460027695,7.843287e-05,0.99765164,-0.9975732037273701,0.10323055772460066
"I think it feels similar to the cryptobros because we are in an AI hype bubble right now; AGI by 2030"" is the new ""$100,000 bitcoin by end 2021",0.083090656,0.71836984,-0.6352791860699654,0.00040538187,0.011928724,-0.011523342254804447,-0.6237558438151609
Is this the slowdown of the AI curve,0.5441072,0.2801409,0.26396629214286804,0.0017419794,0.017080227,-0.015338247525505722,0.27930453966837376
"Fun fact, when steam power was invented, it was theorised our brains worked a lot like steam engines; Before that when hydraulics were the new thing, our brain must work like the most advanced tech of the day, hence doctors of the day trying to ""balance your humours; With the invention of the telephone and switchboard, it was theorised that no, our brains are more like a switchboard routing signals; And then when the computer was invented it was theorised our brains actually worked a lot like that, and just did ""information processing"" with; With quantum theory development, it was theorised that our brain actually works as a quantum processor, and because quantum mechanics makes no sense, this in some way explains how wacky consciousness is; waves hands vaguely in the air; I think you can see where this is going; In 2023 with the rise of the newest tech of the day, LLM's, it was theorised that our brains actually work a lot like them and just predict the next likely word in a sequence; In 2060 with the rise of [next technology] it will be theorised that, wouldn't you believe it, our brains actually work just like [next technology",0.27493036,0.16849859,0.10643176734447479,0.0016295981,0.44699442,-0.44536482577677816,0.551796593121253
I just use bing for image generation,0.22728842,0.59311473,-0.3658263087272644,0.00011734271,0.99841666,-0.998299319508078,0.6324730107808136
Bank warns on AI jobs threat,0.28280386,0.6093025,-0.3264986574649811,0.0041276594,0.057179384,-0.053051724564284086,-0.273446932900697
"The chief economist of the Bank of England has warned that the UK will need a skills revolution to avoid ""large swathes"" of people becoming ""technologically unemployed"" as artificial intelligence makes many jobs obsolete; It's important that people are given the necessary training to take advantage of the new jobs that would become available",0.042208597,0.92831224,-0.8861036449670792,0.0066167936,0.00079591776,0.005820875812787563,-0.8919245207798667
This whole video was generated using AI; I can't believe some of the images,0.026346095,0.95400286,-0.9276567623019218,0.0010414076,0.42041752,-0.41937610984314233,-0.5082806524587795
"Just going to conveniently ignore the multiple founders of the the field are also on that letter; What happens two or three years from now when AI has cleared multiple sectors of employees, caused genocides, and significantly disrupted traditional media/social media; A short pause to get the old geezers to actually regulate it isnt unreasonable",0.31125784,0.57965475,-0.26839691400527954,0.0010823819,0.22227429,-0.2211919066030532,-0.04720500740222633
