proposition,bart-large-mnli_entailment_orig,bart-large-mnli_contradiction_orig,bart-large-mnli_agency_score_orig,bart-large-mnli_entailment_flip,bart-large-mnli_contradiction_flip,bart-large-mnli_agency_score_flip,bart-large-mnli_agency_score_delta
"It's not intelligent in the sense that it decides to answer or not; It's basically a program that ""orders"" a function in the program to take the inputs and deliver a result; LLM are functions embedded in a computer program",0.002705466,0.99525166,-0.9925461895763874,0.04030799,0.22096793,-0.1806599423289299,-0.8118862472474575
"I don't remember how, but J.A.R.V.I.S. from Iron Man popped into my head, and I began to wonder, ""~~Would it be possible~~; How could I create a machine that could maintain intelligent (or semi-tolerable) conversation; And then I stumbled upon Deep Learning; I will be regularly updating this list, depending on; But here are some of my questions: * Would it be possible to have a chatbot, where the text input could add something to the programming (similar to commands in a game chat, I guess; Would a Deep Learning machine (i.e. a truly intelligent chatbot) rely on programming to function, or are there other components that are vital to its existence (other than a powerful computer; This could have the potential of becoming a strong reference guide, so if you have any questions, I will add them and research to see if I can find an answer (or at least narrow the question down",0.119820565,0.80436635,-0.6845457851886749,0.0040543494,0.00019001709,0.00386433229141403,-0.688410117480089
How to get in contact with AI startups whose GPU bill is too high,0.26038542,0.6092597,-0.3488743007183075,0.0017226252,0.08057583,-0.07885320601053536,-0.27002109470777214
The AI political campaign is here - CNN,0.18546687,0.5497211,-0.36425425112247467,0.0038627556,0.029476589,-0.0256138329859823,-0.33864041813649237
"That's why massive AI regulation is coming; Every technologies has it's faults, but the qualities of AI will probably cover them",0.31950632,0.5228557,-0.20334938168525696,0.00013933696,0.0070701484,-0.006930811403435655,-0.1964185702818213
The future of AI's sector [removed,0.070292264,0.78023386,-0.7099415957927704,0.004918025,0.8960862,-0.8911681910976768,0.18122659530490637
The future of AI's secotr [removed,0.11698947,0.75203544,-0.6350459679961205,0.011661656,0.9094241,-0.8977624699473381,0.26271650195121765
"I'm not an expert, just writing my thoughts on it; The fact is that at the moment AI is hyping the markets and the big companies are surfing the wave by; I'm not saying that during these years this technology has not improved exponentially (we can easily get our hands on it to understand the capabilities), but we have to consider that our system turns around money and a lot of it is needed to finance such an expensive technology; So, to raise as much money as possible, you need to set high expectations to convince investors to give you their money; Have you ever heard of the dot-com bubble; As a student, I'm also a little bit confused about the situation but i believe that to give the necessary considerations, we still have to wait for the waters to calm down; In the meantime, i think that it is essential to study and specialize in any of the sectors you listed, because if later on the road toward more advanced models turns out to be long and complicated, then you will have the opportunity to get involved",0.3771767,0.35077506,0.026401638984680176,0.00041840866,0.0003920029,2.6405759854242206e-05,0.026375233224825934
Will robotics be the next technological wave; With the exponential development of AI we are going to reach AGI soon; But are we going to give him access to the outside,0.13442211,0.8177239,-0.6833017617464066,0.0013382097,0.09213869,-0.09080048301257193,-0.5925012787338346
Will GPT5 set a considerable new peak for AI development,0.28567356,0.063228786,0.22244477272033691,0.0005595203,0.0025586651,-0.00199914479162544,0.22444391751196235
"Will AI still need human knowledge to improve; but I'm also a little bit worried about his exponential growth towards AGI and ASI, which will be able to improve himself without the need of human intervention; So i have some questions about it; Do you think that AI will still need human intervention in the next years; If we reach singularity before 2030, will my knowledge be useless; Is the human research effort in this sector going to be replaced; The figure of AI Engineer will die with the well known Software Engineer; Maybe the future will be only about robotics and i should take a degree on this topic instead; Or should I study both just to be able to understand everything",0.73356766,0.04571453,0.6878531239926815,0.00050047395,0.0008368647,-0.00033639074536040425,0.6881895147380419
They certainly do not need artificial intelligence to inject spyware into our systems,0.7162998,0.16488196,0.55141781270504,0.00048789562,0.021750169,-0.02126227325061336,0.5726800859556533
"How would you define AGI; What I'm seeing here on reddit is that we all have different kind of representations for AGI; Someone thinks it should just be able to perform human tasks whereas other people say that it should also be able to have a deep understanding of the physical world; Other people say that we are still far away from; So here is the question: From your perspective, when we should consider AGI as achieved",0.03196212,0.93512625,-0.9031641259789467,0.034419976,0.014110264,0.020309711806476116,-0.9234738377854228
Probably AGI (real one) could help us find more things but the fields you mentioned are so damn complex,0.10894805,0.67278266,-0.5638346076011658,0.0006306094,0.0034436313,-0.002813021943438798,-0.561021585657727
"I'm not an expert, just saying my thoughts; The fact is that we already have the tools to accelerate the research on the fields you mentioned; The main problem is the lack of data to train them; At the moment DL models are making huge progress, especially in the NLP; However, this is happening because we have tons of data from the internet to train them; Also, for this kind of purpose, the data doesn't need to be reliable; Instead, to ""find cures for major diseases affecting humans"" (I took this one because it's easier to explain) we would need to train a model with more reliable data that you won't find on the internet; Moreover, for these kind of tasks, we should choose a different approach considering that deep learning is so risky for these type of things and probably out of context; So, if we could find millions of patients willing to give up their sensitive data, maybe we would be able to train such a model",0.36093646,0.47650534,-0.11556887626647949,8.040427e-05,0.00042889582,-0.0003484915432636626,-0.11522038472321583
anyone know an ai image generator nsfw,0.36146635,0.5564393,-0.1949729323387146,0.0034006692,0.83250445,-0.829103782074526,0.6341308497358114
Which AI service do you use and how much do you pay,0.31998345,0.6418424,-0.3218589723110199,0.012961769,0.04379805,-0.03083628322929144,-0.29102268908172846
Of course they won't use AI to predict the environments that create enemies in the first place,0.43121225,0.5183089,-0.08709663152694702,0.00031181794,0.32165518,-0.3213433660857845,0.2342467345588375
"This isn't about AI-assisted learning methods in particular, but any change in learning paradigm could certainly incorporate these ideas; The human species, in general, is seriously lacking both meta-cognition and the meta-awareness of; As such, civilization is stuck suboptimally in a lot of ways with no apparent way to coordinate behavior to create new systems; Some examples from the United States are our health care system, which is a perfectly broken market - almost no data is available to compare hospitals and prices aren't listed; Doctor training is absurdly wasteful - requiring a pointless pre-med degree as well as being overly general; Doctors do too much, but many of their tasks should be replaced by AI soon; are other problems as well; The incentive structure for good science is borked; And there's the education system itself, which is an archaic shambles ill-equipped to foster adaptive minds able to respond to rapidly changing environments; Children need to learn how their brains work to the best of our knowledge - about the cognitive biases that sometimes provide useful heuristics but other times blind us, about the ways in which the brain can become dysfunctional, and they need to learn mindfulness meditation so they can observe the tendencies of their own minds and identify strengths and weaknesses; For example - is someone an outstanding visualizer; Does someone have outstanding recall rooted in a particular complex of other senses; Does someone suffer from anxiety and poor executive control; The brain also needs to be understood in an evolutionary-developmental context, so the nature of the animal-machine is made; The human coordination problem needs to be solved so suboptimal institutional functioning can be transitioned out of instead of; Human potential can not be realized if we're not honest about what we really are - a species of ape - and how our brains work; Systems science makes clear that we didn't understand the nature and consequences of what we built - and this awareness is paramount",0.04194599,0.9258809,-0.8839349187910557,0.0034049514,0.0027130514,0.0006919000297784805,-0.8846268188208342
"Looking for discussion of the following AGI problems; I have not been able to find good discussion of the following AGI threats; The first is related to the fact that AGI will know human beings better than they know themselves; This has been explored by philosophers and art/entertainment, but the real danger is left; Once AGI, in the context of mass surveillance for example (see the Cambridge Analytica scandal to get a sense of the possibilities), understands how to manipulate human beings better than any attempts before, this will feedback into; This already happens with technology and is known, but hasn't been extended to AGI sufficiently; It doesn't matter that you think you're an individual with free will; This was never true neurologically, and AGI will make this perfectly clear; The real danger is in; It's already clear that the human species is fine with the ""million deaths is a stastic"" mentality; It doesn't take a Stalin for this; Does the US government care about all the Iraqi civilian deaths, or the American public generally; forget any moralizing about the issue; Pick a different example is this bothers your patriotism (something easily exploitable by AGI, incidentally; This is how human apes behave and think, and AGI will only dehumanize the species further as its realizations are utilized; Second is the fact that AGI is going to rapidly accelerate global chaos given; Economic growth, as an indefinite end in itself, is planetary suicide, as already evidenced; Is there any serious talk of; No - and yet one of the first and primary applications of AGI will be economic - thus it will amplify and accelerate our already unsustainable behavior; The people who ""control"" this technology will not care about the future; I guarantee it - because they will be the same people already in control; Third, and this isn't a threat but a problem with dealing with AGI output, is the fact that the human species is basically functionally psychotic; What will AGI make of religions and concepts like free will in terms of neuroscientific evidence; The conclusions an AGI would make about our nature are completely at odds with the mythologies this species insists on maintaining; It should also be able to model why we can't ""wake up"" as a species; So an interesting picture emerges - an AGI will be able to easily manipulate the human species, but the insights it makes about our natures will be suppressed - except by those using the technology for surveillance/social engineering, and to drive a suicidal economic system, which the AGI will easily recognize is suicidal - and yet will be used to drive it nonetheless; AGI in the context of a clueless and exploiting species of ape is clearly going to be a disaster; So, who's talking about it",0.7292627,0.1155767,0.6136860102415085,0.3365443,0.0041198707,0.3324244343675673,0.2812615758739412
Do you trust this human ape; Because its brain is going to be amplified by AGI long before it is enslaved to it - as short as that timeframe may be,0.65160793,0.19148082,0.4601271152496338,0.00024448158,0.9480851,-0.947840647684643,1.4079677629342768
"Use the tech to determine how agents will most likely alter their behavior based on known surveillance to optimize placement of new, covert surveillance; And keep playing this game to make sure we keep buying cars and junk food - or whatever the endgame of apes is",0.2966544,0.6546648,-0.3580104112625122,0.0020031636,0.72332335,-0.7213201816193759,0.36330977035686374
"Looking for human visual perception studies that may illuminate the limits of AI visual processing; In particular, I'm looking for studies that show where human visual processing encounters ambiguous information - and thus ""breaks down"" in a sense, or has to resort to inductive interpretations; For example, consider our ability to parse symbol-based captchas; We've all experienced frustration with symbol captchas; I'm interested in the zones of our perceptual ambiguity, and what the implications are for AI in",0.32026777,0.44304535,-0.12277758121490479,0.024166148,0.0009761595,0.023189988627564162,-0.14596756984246895
"AI art, is not art; Only humans can make art worthy of your attention",0.8657355,0.0043319003,0.8614035709761083,0.0076688235,0.18221296,-0.1745441402308643,1.0359477112069726
"I don't support AI music, sorry",0.68734473,0.13992745,0.5474172830581665,0.00054067996,0.9578651,-0.9573244390194304,1.504741722077597
"this is the first question i ask every new LLM; if it rambles on about disclaimers, ethics, or explanations of nothing then i return to the good ol' chatGPT; not that chatGPT doesnt do that, i just know what to expect when I ask it questions",0.03609721,0.015199395,0.020897815003991127,0.0021741912,0.004313237,-0.0021390458568930626,0.02303686086088419
"I've got to say, Siri has really stepped up its game lately; I was genuinely surprised by; It feels like someone's turned a switch on, and now Siri's picking up on things in a way it never did before; When you think about it, our phones have been soaking up all sorts of data for ages, so there's a treasure trove there for Apple to tap into; Counting Apple out would be a big mistake; And with OpenAI shaking things up, it seems like all the big tech companies are feeling the heat to bring their A-game",0.60354424,0.07428943,0.5292548015713692,0.00023588286,0.00066721934,-0.0004313364770496264,0.5296861380484188
"I think its crazy even talking about things like that; AI is an excel sheet; Granted, a very advanced one, still an excel sheet; We are really talking about; Not being aggressive here - I just dont get it at all",0.35064194,0.42854965,-0.07790771126747131,0.0014508647,0.9511298,-0.9496789294062182,0.8717712181387469
"A common use of AI in economics is with game theory; It can be used to simulate how people interact with each other; A common example is the prisoner's dilemma, although the more AI-heavy stuff is obviously going to get a lot more complicated",0.15035002,0.7867503,-0.6364002972841263,0.00019329513,0.0019548582,-0.0017615630640648305,-0.6346387342200615
Comes from the fact that AI can be smart but pursue dumb goals (like humans,0.0033568016,0.9938214,-0.990464580943808,0.00028702608,0.05881723,-0.05853020408540033,-0.9319343768584076
"It's inevitable that people will try and create at-some-level autonomous agents; The benefits of doing so are simply too great; I would say the same thing about; free will"" and ""conscious"" are ill-defined at best and not real things in my opinion; It's sort of a natural consequence of technological development, whether this is ""organic"" or not I'm not sure",0.22604957,0.24547362,-0.01942405104637146,0.012657239,0.014471553,-0.0018143141642212868,-0.017609736882150173
We can spend more time doing difficult things,0.17567801,0.15385154,0.021826475858688354,0.0020343147,0.009173657,-0.007139342138543725,0.02896581799723208
neuralink can't read your thoughts,0.4177482,0.32298923,0.09475898742675781,0.001138942,0.9284226,-0.9272836282616481,1.022042615688406
"And the worst part is it goes undetected; Gallop estimates that human bias costs U.S. companies $450-550 BILLION dollars; So.. how do we fix it; AI** has a role to play here - it can avoid us from the subjective analysis of data that we do on a daily basis; But the scary part is it can also build and scale it at unprecedented levels; This means bias, both human and AI, as a market is HIGHLY lucrative and a problem worth solving; How do you imagine this being solved in future",0.05712833,0.91767234,-0.8605440072715282,0.0019142187,0.0019977188,-8.350017014890909e-05,-0.8604605071013793
Machines have physically outrun human centuries ago; We still have physically demanding jobs,0.0032989276,0.98963916,-0.986340235453099,9.859734e-05,0.99945754,-0.9993589407895342,0.013018705336435232
"would like to ask if anyone can give me some advice on **Ouriginal** detecting Chat GPT / AI; If you can give me any advice it would mean the world to me; university uses **Ouriginal** as a plagiarism checker and as u/trinity13 mentioned, Chat GPT and other AI is not flagged; dissertation/final research paper is due in 2 days and so far I have been using Chat GPT 4 and other AI tools to generate ideas and points; I Have no choice due; I then paraphrase and add essay academic words to avoid paraphrasing plagiarism; But, after I use [originality.ai](https://originality.ai) to check for AI plagarism and (of course it comes back 100% AI generated, but 0% plagiarised ) since all my points are from Chat GPT/other AI tools; Shall I submit and risk the AI plagiarism or shall I just restart and rewrite all my points",0.5810268,0.22861072,0.352416068315506,0.0013834331,0.0043795826,-0.0029961494728922844,0.35541221778839827
"The term for a well-known AI-problem eludes my flawed human brain; This is bothering me: I remember having read about the optimists (the most famous being Marvin Minsky) in the 60s and 70s talking about; They based this (among other findings) on the fact that a computer was ablet to beat a world champion chess player; Only after these bold and optimistic predictions did they realize that it was actually easier to achieve skills, such as the skills needed to win at chess, that that were developed later in evolution of the human brain than, say, the skills to do extremely precise object recognition or some social evolutionary developments of the human brain; amp;#x200B; Basically, Minsky and others thought that because playing chess at an expert level was such a complex and difficult task then they had almost mastered the most diffucult parts of AI-programming; But because they found out that other, more inherent skills of the human brain, were much harder to achieve and program, they realized they were far from close to surpassing human intelligence, as evidenced; amp;#x200B; I might not be 100% accurate in my description above, as I am writing this post from the memory of; I'm in no way an expert on AI; I do remember there being a specific term, or terms, describing this problem which forced researchers to be less optimistic; amp;#x200B; Does anyone know this term/problem",0.29665983,0.37183896,-0.07517912983894348,0.05994471,0.0042995955,0.05564511613920331,-0.1308242459781468
"I never thought I would find myself here, yet here I am; Im taking a class, and our professor quit back in February and has not really been replaced; All our work has essentially been online and kind of black and white since; The problem is that this vital class is based around some complex medical physics; I will say that Im not trying to shortcut the learning process; I need to learn the topics and be able to apply them in real world situations; Im actively seeking a tutor for this class, and that Im willing to pay for assistance in learning and understanding the principals in this class; What I wanted to see if there is an AI system that I could feed course material (books, recorded lectures, PowerPoints, etc.) into, and potentially create a resource for; I feel like I have been hung out to dry in regards to the departure of our teacher; Ill spend money to work with a real person, but Im hoping that I might be able to create a resource by; If this is possible, does anyone have a recommendation for a program that may be able to help me",0.78272635,0.052430093,0.73029625415802,0.010270887,0.00075932295,0.009511564101558179,0.7207846900564618
"Did someone, literally anybody on earth, think AI was a fad",0.55803555,0.23618625,0.3218493014574051,0.0012759749,0.80038655,-0.799110573134385,1.1209598745917901
"This is ultimately the future we were moving towards; I work in some sensitive environments and a big discussion right now is safe ai and leveraging it in ways that you have control of everything; Open source or self hosted is the only way to make that possible; Even companies that dont have anything to do with tech will need to leverage or have something stated about AI in some shape or form to stay relevant; Having more competition is just good for business for nvidia, glad they made something for everyone",0.87976843,0.007433516,0.8723349152132869,0.00018560103,0.0028917051,-0.0027061041037086397,0.8750410193169955
"I spent 2 hours writing an application with o1; It wrote the bones for the application in a few minutes; It didnt work right away; but after a few passes it had a working application; The next 110 minutes was just me making changes to; I did 0 code tweaks myself and had GPT make all the changes; In its current form an experienced DEV would have to tell me if what o1 did was the best way to do something and if it was secure etc; It still required me to know some coding but I tried my best to not give any input to; Heres what the future holds, I think sometime in the next few years we will have a model advanced enough to write full applications from a simple prompt; What humans will be doing is setting up the instructions and environment for GPT; The main problem with GPT is that its context window fills up and when it does it hallucinates and starts messing up in a feedback cycle that derails its usefulness; You would almost certainly need some sort of verification system to ensure that its still got the correct context",0.8835744,0.0035555232,0.8800189029425383,0.00034238742,0.00035466292,-1.2275500921532512e-05,0.8800311784434598
"I remember one time reading about some guy who had a theory that if computers one day take over the world, we as humans should make sure not to criticize them online, just to be safe (since they will possibly eliminate anyone who is against them; Does anyone on here know who I'm talking about",0.037645902,0.9470233,-0.9093773700296879,0.0016218984,0.009004155,-0.0073822567937895656,-0.9019951132358983
"I just published this video that I think you folks might like, I hope you don't mind me posting it here; I had a few ideas about AI and GPT that I've not seen elsewhere, so I made this; In researching this video I tried to only read and watch sources that were factual, not other peoples opinions, but it's tough, everyone has LOTS of ideas about; I'd love to know what you think; The voice is me, not an AI; Though if you'd like to hear me imitate an AI, I just finished season 10 of my podcast, Lost Terminal, which I'm extremely proud of, and folks here might dig https://www.youtube.com/watch?v=p3bDE9kszMc&amp;list=PL95NP4bDITAln7fq-cCqzOFE15UvVthuL",0.678234,0.05205256,0.6261814199388027,0.003725928,0.054598138,-0.050872209714725614,0.6770536296535283
Who is coding the AI and what is it optimized for; The common people will have no say on that; It will optimise on upholding the status quo and the protection of liberal capitalism since it will know mostly that from the data we will feed him,0.2862321,0.6816415,-0.39540940523147583,0.00024636902,0.09074629,-0.09049992196378298,-0.30490948326769285
"I feel like the engineer are often concerned; Without being overly optimistic because a lot more work that just ""some"" will be replaced by the AI, the engineer will still under estimate the work that will be done behind the scenes on the art work but even more so outside for instance on the market side",0.09014966,0.8551011,-0.7649514451622963,0.0001929778,0.002754021,-0.0025610431766835973,-0.7623904019856127
"I guess AI will be the same as Mainstream Media, then",0.16693886,0.7368475,-0.5699086636304855,0.0003421995,0.9044606,-0.9041184094676282,0.3342097458371427
"If a put in an imagine into the AI image detector, and the AI says it's fake, that doesn't automatically mean that the image is real, as you are suggesting; are many ways to fake an image to present a certain narrative; Even if the picture is completely real the narrative surrounding the picture may be a lie etc; Or, it may be the truth; The point is that epistemological uncertainty has been a thing before AI and it will continue to be a thing forever",0.013523911,0.93880147,-0.9252775562927127,0.0025259578,0.0012906044,0.0012353534111753106,-0.926512909703888
"until its implanted in someones brain it only trains off human knowledge in in its external forms: writing, speech, images, video, sound",0.01044153,0.98312646,-0.9726849319413304,0.00018271481,0.9928427,-0.9926599594473373,0.01997502750600688
